{"$schema":"https://json-schema.org/draft/2020-12/schema","$id":"https://socioprophet.org/contracts/RevocationToken.v0.1.json","title":"RevocationToken","type":"object","additionalProperties":false,"required":["version","token_id","scope_ref","subject_commitment","issued_at","issuer_ref","reason_code","status"],"properties":{"version":{"const":"0.1"},"token_id":{"type":"string"},"scope_ref":{"type":"string"},"subject_commitment":{"type":"string"},"issued_at":{"type":"string","format":"date-time"},"issuer_ref":{"type":"string"},"reason_code":{"type":"string"},"evidence_refs":{"type":"array","items":{"type":"string"}},"status":{"type":"string","enum":["active","expired","rescinded"]}}}